{
  "benchmark": {
    "id": "csfb",
    "name": "Chinese Speech Follow Benchmark",
    "version": "0.2.0-preview",
    "protocol_version": "0.1.0-draft",
    "mode": "OPEN_SUITE",
    "domain": "speech-follow"
  },
  "dataset": {
    "version": "0.2.0-preview",
    "cases": 6629,
    "events": 48851,
    "hash": "242a593739e55a02f305ffce0350425b04d5aad0ef1781d0a4190ab67195fcdf",
    "seed": 20260923
  },
  "runner": { "version": "0.2.1" },
  "metrics": { "version": "0.2.0" },
  "baselines": [
    { "id": "global-exact", "version": "0.2.0" },
    { "id": "global-fuzzy", "version": "0.2.0" },
    { "id": "local-fuzzy", "version": "0.2.0" }
  ]
}
