{
  "benchmark": {
    "id": "quant-strategy",
    "name": "Quant Strategy Black-box Benchmark",
    "version": "0.1.0-draft",
    "protocol_version": "0.1.0-draft",
    "mode": "HIDDEN_SUITE",
    "domain": "quant-strategy"
  },
  "dataset": {
    "version": "0.1.0-draft",
    "cases": 3,
    "events": 3,
    "hash": "1e391009b2fa3b39b31d82f3538d35c39427826209658ddaeeefe4be2514b1da",
    "seed": 20260927
  },
  "runner": { "version": "0.1.0-draft" },
  "metrics": { "version": "0.1.0-draft" },
  "baselines": []
}
